[
  {
    "id": "e04a9d04-da00-46d5-91ea-7c240e0df0c4",
    "name": "Dev Host",
    "description": "Generated by profile_cli",
    "isActive": true,
    "createdAt": "2025-12-19T20:59:56Z",
    "modifiedAt": "2025-12-19T20:59:56Z",
    "cpuModel": "Development CPU",
    "ramMB": 8192,
    "osVersion": "Development",
    "devices": [
      {
        "name": "AndroidAuto",
        "type": "AndroidAuto",
        "enabled": true,
        "useMock": false,
        "description": "Android Auto projection service",
        "settings": {
          "resolution": "1024x600",
          "fps": 30,
          "generateTestVideo": false,
          "channels.video": true,
          "channels.mediaAudio": true,
          "connectionMode": "auto",
          "wireless.enabled": false,
          "wireless.host": "",
          "wireless.port": 5277
        }
      },
      {
        "name": "Bluetooth",
        "type": "Bluetooth",
        "enabled": true,
        "useMock": false,
        "description": "Bluetooth adapter"
      }
    ]
  }
]
